{
  "asset_tag": "EE-DEMO-003",
  "created_at": "2026-08-04T07:59:00+00:00",
  "id": "source-01",
  "kind": "function generator and DC source",
  "manufacturer": "Acme Metrology",
  "model": "SourceBox 80",
  "notes": "Synthetic identity used only in the public demonstration.",
  "schema": "benchlineage/instrument/v1",
  "serial": "SYN-SRC-0009"
}
