{
  "asset_tag": "EE-DEMO-001",
  "created_at": "2026-08-04T07:59:00+00:00",
  "id": "scope-01",
  "kind": "oscilloscope",
  "manufacturer": "Acme Metrology",
  "model": "WaveView 2000",
  "notes": "Synthetic identity used only in the public demonstration.",
  "schema": "benchlineage/instrument/v1",
  "serial": "SYN-SCOPE-0042"
}
