{
  "asset_tag": "EE-DEMO-002",
  "created_at": "2026-08-04T07:59:00+00:00",
  "id": "dmm-01",
  "kind": "digital multimeter",
  "manufacturer": "Acme Metrology",
  "model": "CountPro 6.5",
  "notes": "Synthetic identity used only in the public demonstration.",
  "schema": "benchlineage/instrument/v1",
  "serial": "SYN-DMM-0017"
}
